{
  "schema_version": "uisemtest-recording-suite-v1",
  "suite_id": "conduit-modular-v1",
  "subject": "conduit",
  "modules": [
    {
      "module_id": "auth-route",
      "case_ids": [
        "L1-AUTH-01", "L1-AUTH-02", "L1-AUTH-03", "L1-AUTH-04",
        "L1-AUTH-05", "L1-AUTH-06", "L1-AUTH-07", "L2-AUTH-01",
        "L2-GUEST-01"
      ]
    },
    {
      "module_id": "feed-tag",
      "case_ids": ["L1-FEED-01", "L1-FEED-02", "L1-FEED-03", "L2-TAG-01"]
    },
    {
      "module_id": "article",
      "case_ids": [
        "L1-ARTICLE-01", "L1-ARTICLE-02", "L1-ARTICLE-03",
        "L1-ARTICLE-04", "L1-ARTICLE-05", "L1-ARTICLE-06",
        "L1-ARTICLE-07", "L2-ARTICLE-01", "L3-ARTICLE-01",
        "L4-PUBLISH-01", "L4-EDIT-01", "L4-DELETE-01"
      ]
    },
    {
      "module_id": "comment",
      "case_ids": ["L1-COMMENT-01", "L1-COMMENT-02", "L3-COMMENT-01", "L4-COMMENT-01"]
    },
    {
      "module_id": "profile-social",
      "case_ids": [
        "L1-PROFILE-01", "L1-PROFILE-02", "L1-SOCIAL-01",
        "L3-SOCIAL-02", "L4-FOLLOW-01", "L4-FAVORITE-01"
      ]
    },
    {
      "module_id": "settings",
      "case_ids": ["L1-SETTINGS-01", "L2-SETTINGS-01", "L2-SETTINGS-02"]
    }
  ],
  "case_count": 38,
  "cases": [
    {
      "case_id": "L1-AUTH-01",
      "layer": 1,
      "actors": [
        "guest"
      ],
      "initial_auth": "none",
      "workflow": "l1-auth-01.json"
    },
    {
      "case_id": "L1-AUTH-02",
      "layer": 1,
      "actors": [
        "guest"
      ],
      "initial_auth": "none",
      "workflow": "l1-auth-02.json"
    },
    {
      "case_id": "L1-AUTH-03",
      "layer": 1,
      "actors": [
        "actor_a"
      ],
      "initial_auth": "none",
      "workflow": "l1-auth-03.json"
    },
    {
      "case_id": "L1-AUTH-04",
      "layer": 1,
      "actors": [
        "actor_a"
      ],
      "initial_auth": "none",
      "workflow": "l1-auth-04.json"
    },
    {
      "case_id": "L1-AUTH-05",
      "layer": 1,
      "actors": [
        "actor_a"
      ],
      "initial_auth": "authenticated",
      "workflow": "l1-auth-05.json"
    },
    {
      "case_id": "L1-AUTH-06",
      "layer": 1,
      "actors": [
        "guest"
      ],
      "initial_auth": "none",
      "workflow": "l1-auth-06.json"
    },
    {
      "case_id": "L1-AUTH-07",
      "layer": 1,
      "actors": [
        "guest"
      ],
      "initial_auth": "none",
      "workflow": "l1-auth-07.json"
    },
    {
      "case_id": "L1-FEED-01",
      "layer": 1,
      "actors": [
        "guest"
      ],
      "initial_auth": "none",
      "workflow": "l1-feed-01.json"
    },
    {
      "case_id": "L1-FEED-02",
      "layer": 1,
      "actors": [
        "actor_a"
      ],
      "initial_auth": "authenticated",
      "workflow": "l1-feed-02.json"
    },
    {
      "case_id": "L1-FEED-03",
      "layer": 1,
      "actors": [
        "actor_a"
      ],
      "initial_auth": "authenticated",
      "workflow": "l1-feed-03.json"
    },
    {
      "case_id": "L1-ARTICLE-01",
      "layer": 1,
      "actors": [
        "actor_a"
      ],
      "initial_auth": "authenticated",
      "workflow": "l1-article-01.json"
    },
    {
      "case_id": "L1-ARTICLE-02",
      "layer": 1,
      "actors": [
        "actor_a"
      ],
      "initial_auth": "authenticated",
      "workflow": "l1-article-02.json"
    },
    {
      "case_id": "L1-ARTICLE-03",
      "layer": 1,
      "actors": [
        "actor_a"
      ],
      "initial_auth": "authenticated",
      "workflow": "l1-article-03.json"
    },
    {
      "case_id": "L1-ARTICLE-04",
      "layer": 1,
      "actors": [
        "actor_a"
      ],
      "initial_auth": "authenticated",
      "workflow": "l1-article-04.json"
    },
    {
      "case_id": "L1-ARTICLE-05",
      "layer": 1,
      "actors": [
        "actor_a"
      ],
      "initial_auth": "authenticated",
      "workflow": "l1-article-05.json"
    },
    {
      "case_id": "L1-ARTICLE-06",
      "layer": 1,
      "actors": [
        "guest"
      ],
      "initial_auth": "none",
      "workflow": "l1-article-06.json"
    },
    {
      "case_id": "L1-ARTICLE-07",
      "layer": 1,
      "actors": [
        "actor_a"
      ],
      "initial_auth": "authenticated",
      "workflow": "l1-article-07.json"
    },
    {
      "case_id": "L1-COMMENT-01",
      "layer": 1,
      "actors": [
        "actor_a"
      ],
      "initial_auth": "authenticated",
      "workflow": "l1-comment-01.json"
    },
    {
      "case_id": "L1-COMMENT-02",
      "layer": 1,
      "actors": [
        "actor_a"
      ],
      "initial_auth": "authenticated",
      "workflow": "l1-comment-02.json"
    },
    {
      "case_id": "L1-PROFILE-01",
      "layer": 1,
      "actors": [
        "actor_a"
      ],
      "initial_auth": "authenticated",
      "workflow": "l1-profile-01.json"
    },
    {
      "case_id": "L1-PROFILE-02",
      "layer": 1,
      "actors": [
        "guest"
      ],
      "initial_auth": "none",
      "workflow": "l1-profile-02.json"
    },
    {
      "case_id": "L1-SOCIAL-01",
      "layer": 1,
      "actors": [
        "actor_a"
      ],
      "initial_auth": "authenticated",
      "workflow": "l1-social-01.json"
    },
    {
      "case_id": "L1-SETTINGS-01",
      "layer": 1,
      "actors": [
        "actor_a"
      ],
      "initial_auth": "authenticated",
      "workflow": "l1-settings-01.json"
    },
    {
      "case_id": "L2-AUTH-01",
      "layer": 2,
      "actors": [
        "actor_a"
      ],
      "initial_auth": "none",
      "workflow": "l2-auth-01.json"
    },
    {
      "case_id": "L2-GUEST-01",
      "layer": 2,
      "actors": [
        "actor_a"
      ],
      "initial_auth": "authenticated",
      "workflow": "l2-guest-01.json"
    },
    {
      "case_id": "L2-ARTICLE-01",
      "layer": 2,
      "actors": [
        "actor_a"
      ],
      "initial_auth": "authenticated",
      "workflow": "l2-article-01.json"
    },
    {
      "case_id": "L2-SETTINGS-01",
      "layer": 2,
      "actors": [
        "actor_a",
        "actor_b"
      ],
      "initial_auth": "authenticated",
      "workflow": "l2-settings-01.json"
    },
    {
      "case_id": "L2-SETTINGS-02",
      "layer": 2,
      "actors": [
        "actor_a"
      ],
      "initial_auth": "authenticated",
      "workflow": "l2-settings-02.json"
    },
    {
      "case_id": "L2-TAG-01",
      "layer": 2,
      "actors": [
        "actor_a"
      ],
      "initial_auth": "authenticated",
      "workflow": "l2-tag-01.json"
    },
    {
      "case_id": "L3-ARTICLE-01",
      "layer": 3,
      "actors": [
        "actor_a",
        "actor_b"
      ],
      "initial_auth": "authenticated",
      "workflow": "l3-article-01.json"
    },
    {
      "case_id": "L3-COMMENT-01",
      "layer": 3,
      "actors": [
        "actor_a",
        "actor_b"
      ],
      "initial_auth": "authenticated",
      "workflow": "l3-comment-01.json"
    },
    {
      "case_id": "L3-SOCIAL-02",
      "layer": 3,
      "actors": [
        "actor_a",
        "actor_b"
      ],
      "initial_auth": "authenticated",
      "workflow": "l3-social-02.json"
    },
    {
      "case_id": "L4-PUBLISH-01",
      "layer": 4,
      "actors": [
        "actor_a",
        "actor_b"
      ],
      "initial_auth": "authenticated",
      "workflow": "l4-publish-01.json"
    },
    {
      "case_id": "L4-FOLLOW-01",
      "layer": 4,
      "actors": [
        "actor_a",
        "actor_b"
      ],
      "initial_auth": "authenticated",
      "workflow": "l4-follow-01.json"
    },
    {
      "case_id": "L4-FAVORITE-01",
      "layer": 4,
      "actors": [
        "actor_a",
        "actor_b"
      ],
      "initial_auth": "authenticated",
      "workflow": "l4-favorite-01.json"
    },
    {
      "case_id": "L4-COMMENT-01",
      "layer": 4,
      "actors": [
        "actor_a",
        "actor_b"
      ],
      "initial_auth": "authenticated",
      "workflow": "l4-comment-01.json"
    },
    {
      "case_id": "L4-EDIT-01",
      "layer": 4,
      "actors": [
        "actor_a",
        "actor_b"
      ],
      "initial_auth": "authenticated",
      "workflow": "l4-edit-01.json"
    },
    {
      "case_id": "L4-DELETE-01",
      "layer": 4,
      "actors": [
        "actor_a",
        "actor_b"
      ],
      "initial_auth": "authenticated",
      "workflow": "l4-delete-01.json"
    }
  ]
}
